name_en,name_kn,code,pop,area,mla_en,mla_kn,mla_party,elec_year,news_1,news_1_link,news_2,news_2_link,news_3,news_3_link,news_4,news_4_link,news_5,news_5_link,news_6,news_6_link,cm_article,,
BTM Layout,ಬಿಟಿಎಂ ಲೇಔಟ್,172,264553,15,Ramalinga Reddy,ರಾಮಲಿಂಗಾ ರೆಡ್ಡಿ,inc,2018,Ramalinga reddy alleges govt has diverted funds for flyover to BJP MLA's constituency,https://bangaloremirror.indiatimes.com/bangalore/civic/will-it-be-a-flyover-to-nowhere-at-ejipura/articleshow/71302270.cms?utm_source=contentofinterest&utm_medium=text&utm_campaign=cppst,Ramalinga Reddy to adopt schools in BTM,https://www.newindianexpress.com/cities/bengaluru/2021/feb/10/ramalinga-reddy-toadopt-schools-in-btm-2261986.html,Hardik Patel roped in to stop Ramalinga Reddy's winning spree,https://www.thehansindia.com/karnataka/hardik-patel-roped-in-to-stop-ramalinga-reddys-winning-spree-794374,,,,,,,https://bengaluru.citizenmatters.in/btm-layout-assembly-constituency-voter-information-112178,,
Jayanagar,ಜಯನಗರ,173,201625,9,Sowmya Reddy,ಸೌಮ್ಯಾ ರೆಡ್ಡಿ,inc,2018,Congress MLA's car seized in Karnataka for violating model code of conduct,https://www.newindianexpress.com/states/karnataka/2023/apr/07/congress-mlas-car-seized-in-karnataka-for-violating-model-code-of-conduct-2563662.html,Four former BBMP corporators accuse MLA of blocking development works,https://www.newindianexpress.com/states/karnataka/2023/feb/17/ex-corporators-protest-poll-stunt-says-jayanagar-mla-2548191.html,"In Sowmya Reddy, state gets its first vegan MLA",https://bangaloremirror.indiatimes.com/bangalore/others/in-sowmya-reddy-state-gets-its-first-vegan-mla/articleshow/64579009.cms?utm_source=contentofinterest&utm_medium=text&utm_campaign=cppst,"Accused of hitting home guard, MLA Sowmya says she was abused",https://www.deccanherald.com/city/accused-of-hitting-home-guard-mla-sowmya-says-she-was-abused-941440.html,,,,,https://bengaluru.citizenmatters.in/jayanagar-assembly-constituency-voter-information-112330,,
Mahadevapura,ಮಹದೇವಪುರ,174,572539,244,Aravind Limbavali,ಅರವಿಂದ ಲಿಂಬಾವಳಿ,bjp,2018,"BJP dumps Aravind Limbavali as candidate, gives ticket to wife Manjula",https://www.thenewsminute.com/article/bjp-dumps-aravind-limbavali-mahadevapura-candidate-gives-ticket-wife-manjula-176017,Arvind Limbavali allegedly behaved rudely and verbally abused a woman while on a visit to Whitefield,https://www.thehindu.com/news/national/karnataka/razing-of-structures-limbavali-draws-flak-over-behaviour-with-woman/article65844729.ece,"FIR against MLA and others in connection with the suicide case of Bengaluru industrialist, Pradeep",https://www.deccanherald.com/state/karnataka-politics/industrialist-suicide-case-karnataka-bjp-mla-5-others-booked-cm-says-action-as-per-law-1177209.html,MLA backed a road project which falls in the buffer zone of Pattandur Agrahara Lake,https://indianexpress.com/article/cities/bangalore/mahadevapura-mla-road-project-pattanduragrahara-lake-buffer-zone-7975528/,,,,,https://bengaluru.citizenmatters.in/mahadevapura-assembly-constituency-voter-information-112855,,
Bommanahalli,ಬೊಮ್ಮನಹಳ್ಳಿ,175,432752,32,Sathish Reddy M,ಸತೀಶ್ ರೆಡ್ಡಿ ಎಂ,bjp,2018,Bommanahalli MLA shuts down troublesome KCDC processing plant,https://www.deccanherald.com/city/top-bengaluru-stories/bommanahalli-mla-shuts-down-troublesome-kcdc-processing-plant-1214024.html,MLA allegedly behind the scam involving blocking of hospital beds meant for COVID patients,https://www.newindianexpress.com/states/karnataka/2021/may/06/congress-demands-arrest-of-tejasvi-surya-bjp-mla-sathish-reddy-for-covid-bed-scam-2299243.html,"Waterlogging, potholes: KPCC leader slams MLA for poor road infra",https://www.hindustantimes.com/cities/bengaluru-news/waterlogging-potholes-kpcc-leader-slams-mla-in-bengaluru-for-poor-road-infra-101660035635923.html,MLA M Sathish Reddy files writ on delimitation,https://timesofindia.indiatimes.com/city/bengaluru/karnataka-mla-m-sathish-reddy-files-writ-on-delimitation/articleshow/95730805.cms,,,,,https://bengaluru.citizenmatters.in/bommanahalli-assembly-constituency-voter-information-113514,,
Bangalore South,ಬೆಂಗಳೂರು ದಕ್ಷಿಣ,176,650532,234,Krishnappa M,ಕೃಷ್ಣಪ್ಪ ಎಂ,bjp,2018,"Twitter campaign on pathetic road jolts Bengaluru MLA, BDA into action",https://www.deccanherald.com/city/bengaluru-infrastructure/twitter-campaign-on-pathetic-road-jolts-bengaluru-mla-bda-into-action-1026387.html,"M Krishnappa adopts elephant, tigress to support ex-situ conservation",https://bangaloremirror.indiatimes.com/bangalore/others/bengaluru-mla-m-krishnappa-adopts-elephant-tigress/articleshow/75665591.cms,"Lokayukta Justice declared that M Krishnappa, should not continue in his post as allegations against him are substantial",https://www.deccanherald.com/content/446744/mla-krishnappa-should-not-hold.html,MLA neither bothered about the problems of citizens around Bellandur lake nor NGT order,https://bangaloremirror.indiatimes.com/bangalore/cover-story/silt-still-in-transit/articleshow/91500078.cms,,,,,https://bengaluru.citizenmatters.in/bangalore-south-assembly-constituency-voter-information-112325,,
Anekal,ಆನೇಕಲ್,177,376101,383,B Shivanna,ಬಿ ಶಿವಣ್ಣ,inc,2018,Superstitious Anekal Congress candidate waits to enter from right side of gate to file nomination,https://www.news9live.com/elections/karnataka-assembly-election/watch-video-superstitious-anekal-congress-candidate-waits-to-enter-from-right-side-of-gate-to-file-nomination-au2327-2112003,IT officials raid on Shivanna’s residence did not yield any implicating records,https://www.udayavani.com/english-news/it-officials-raid-congress-leader-shivannas-residence,PSI transferred after filing case against rowdy,https://www.thehindu.com/news/cities/bangalore/PSI-transferred-after-filing-case-against-rowdy/article16444374.ece,Political differences with MLA said to have ended in the murder of Bommasandra Town Municipalty Council member,https://www.deccanherald.com/content/601441/political-differences-suspected-behind-killing.html,,,,,https://bengaluru.citizenmatters.in/anekal-sc-assembly-constituency-voter-information-113239,,